{
  "domainName": "parkorchardslocalplumber.com.au",
  "domainType": "added",
  "createdDateISO8601": null,
  "updatedDateISO8601": "2025-04-08T04:09:39+00:00",
  "expiresDateISO8601": null,
  "createdDateRaw": "",
  "updatedDateRaw": "2025-04-08T04:09:39Z",
  "expiresDateRaw": "",
  "audit": {
    "createdDate": "2025-06-29T15:52:36+00:00",
    "updatedDate": "2025-06-29T15:52:36+00:00"
  },
  "nameServers": ["ns1.247localplumber.com.au|ns2.247localplumber.com.au"],
  "whoisServer": "whois.auda.org.au",
  "registrarName": "Domain Directors Pty Ltd trading as Instra",
  "status": [
    "serverRenewProhibited",
    "https://identitydigital.au/get-au/whois-status-codes#serverRenewProhibited"
  ],
  "cleanText": "Domain Name: parkorchardslocalplumber.com.au\nRegistry Domain ID: 49628e24c0f04a9a9108677d2e40e8a4-AU\nRegistrar WHOIS Server: whois.auda.org.au\nRegistrar URL: https://www.instra.com/en/about-us/contact-us\nLast Modified: 2025-04-08T04:09:39Z\nRegistrar Name: Domain Directors Pty Ltd trading as Instra\nRegistrar Abuse Contact Email: abuse@key-systems.net\nRegistrar Abuse Contact Phone: +49.68949396850\nReseller Name: \nStatus: serverRenewProhibited https://identitydigital.au/get-au/whois-status-codes#serverRenewProhibited\nStatus Reason: Not Currently Eligible For Renewal\nRegistrant Contact ID: b2d89885e1cf4e479657e343e83fb5fb-AU\nRegistrant Contact Name: John Smith\nTech Contact ID: 8bc9c8402ed545dcb37c13ad092efec8-AU\nTech Contact Name: John Smith\nName Server: ns1.247localplumber.com.au\nName Server IP: 103.26.237.110\nName Server: ns2.247localplumber.com.au\nName Server IP: 103.26.237.110\nDNSSEC: unsigned\nRegistrant: TAW FAMILY HOLDINGS PTY LTD as The Trustee for The Watson Family Trust\nRegistrant ID: ACN 627595215\nEligibility Type: Trust\nEligibility Name: The Trustee for The Watson Family Trust\nEligibility ID: ABN 11943603845\n>>> Last update of WHOIS database: 2025-06-29T14:47:19Z <<<\nIdentity Digital Australia Pty Ltd, for itself and on behalf of .au Domain Administration Limited (auDA), makes the WHOIS registration data directory service (WHOIS Service) available solely for the purposes of:\n(a) querying the availability of a domain name licence;\n(b) identifying the holder of a domain name licence; and/or\n(c) contacting the holder of a domain name licence in relation to that domain name and its use.\nThe WHOIS Service must not be used for any other purpose (even if that purpose is lawful), including:\n(a) aggregating, collecting or compiling information from the WHOIS database, whether for personal or commercial purposes;\n(b) enabling the sending of unsolicited electronic communications; and / or\n(c) enabling high volume, automated, electronic processes that send queries or data to the systems of Afilias, any registrar, any domain name licence holder, or auDA.\nThe WHOIS Service is provided for information purposes only. By using the WHOIS Service, you agree to be bound by these terms and conditions. The WHOIS Service is operated in\naccordance with the auDA WHOIS Policy (available at https://www.auda.org.au/policy/2014-07-whois-policy).",
  "rawText": "",
  "registrantContact": {
    "name": "John Smith",
    "organization": "TAW FAMILY HOLDINGS PTY LTD as The Trustee for The Watson Family Trust",
    "street": "",
    "city": "",
    "state": "",
    "postalCode": "",
    "country": "",
    "email": "",
    "telephone": "",
    "telephoneExt": "",
    "fax": "",
    "faxExt": "",
    "rawText": "Registrant Contact Name: John Smith"
  },
  "administrativeContact": {
    "name": "",
    "organization": "",
    "street": "",
    "city": "",
    "state": "",
    "postalCode": "",
    "country": "",
    "email": "",
    "telephone": "",
    "telephoneExt": "",
    "fax": "",
    "faxExt": "",
    "rawText": ""
  },
  "technicalContact": {
    "name": "John Smith",
    "organization": "",
    "street": "",
    "city": "",
    "state": "",
    "postalCode": "",
    "country": "",
    "email": "",
    "telephone": "",
    "telephoneExt": "",
    "fax": "",
    "faxExt": "",
    "rawText": "Tech Contact Name: John Smith"
  },
  "billingContact": {
    "name": "",
    "organization": "",
    "street": "",
    "city": "",
    "state": "",
    "postalCode": "",
    "country": "",
    "email": "",
    "telephone": "",
    "telephoneExt": "",
    "fax": "",
    "faxExt": "",
    "rawText": ""
  },
  "zoneContact": {
    "name": "",
    "organization": "",
    "street": "",
    "city": "",
    "state": "",
    "postalCode": "",
    "country": "",
    "email": "",
    "telephone": "",
    "telephoneExt": "",
    "fax": "",
    "faxExt": "",
    "rawText": ""
  }
}
